{
  "schema": "https://deepworkplan.com/schema/addon-descriptor/v1.json",
  "key": "devcontainer",
  "product": { "repo": "DailybotHQ/devcontainer-kit", "tag": "v0.3.3", "interface": 2 },
  "detect": { "command": "dck doctor --json", "interface_from": "json:interface" },
  "provides_abilities": [],
  "requires_grants": []
}
